tweet_id,text,language,type,bookmark_count,favorite_count,retweet_count,reply_count,view_count,created_at,client,hashtags,urls,media_type,media_urls
'2014032835259277467',How weak and pathetic do you have to be to be this scared of a fireside chat?,en,Tweet,35,2681,410,261,78387,2026-01-21 12:50:21,"<a href=""http://twitter.com/download/iphone"" rel=""nofollow"">Twitter for iPhone</a>",,,,
'2014015019743142024',"Donald Trump’s America:

 - Weakest job growth outside a recession since 2003
- Rising unemployment
- Manufacturing jobs shrinking
- Inflation up
- Electricity prices up 
- Mortgage rates painfully high",en,Tweet,88,6218,1280,1244,113825,2026-01-21 11:39:33,"<a href=""http://twitter.com/download/iphone"" rel=""nofollow"">Twitter for iPhone</a>",,,,
'2013640736755892676',"America is running out of Nickel. The Eagle Mine, the U.S.' only producing Nickel asset, is scheduled for closure in 2027. If @realDonaldTrump @JDVance  wants to secure the nations supply of a critical metal for national security, there is literally only one company that can bring an asset to production within 3 years - Homeland Nickel Inc, trading as SHL.V and SRCGF.  Don't even get me started on how @elonmusk  plans to feed his Tesla Nickel refinery. The question is, will they act before it's too late? Read the full thesis, link in bio.",en,Tweet,12,51,6,4,126856,2026-01-20 10:52:17,"<a href=""https://mobile.twitter.com"" rel=""nofollow"">Twitter Web App</a>",,,,
'2014000625483129248',"RT @undefined: COLLINS: Did it stand out to you that he said Iceland multiple times when he was talking about Greenland?

NEWSOM: And that every time a windmill turns it costs $1,000. A lot of stuff stands out. None of this is normal. There's a deviancy of consciousness. He's graded off the curve.",en,Retweet,671,14683,2479,175,587001,2026-01-21 10:42:22,"<a href=""https://snapstream.com"" rel=""nofollow"">SnapStream TV Search</a>",,,video,https://video.twimg.com/amplify_video/2014000586648166401/vid/avc1/1280x720/VN8ApUyTYz8LvBgB.mp4?tag=14
'2014004121951514881',"Well, that was boring.",en,Tweet,120,15960,794,1859,406837,2026-01-21 10:56:15,"<a href=""http://twitter.com/download/iphone"" rel=""nofollow"">Twitter for iPhone</a>",,,,
'2013977202878988484',RT @undefined: Dozy Don conquers Davos! https://t.co/vZZAmCEc7K,fr,Retweet,72,7357,993,317,102343,2026-01-21 09:09:17,"<a href=""http://twitter.com/download/iphone"" rel=""nofollow"">Twitter for iPhone</a>",,,photo,https://pbs.twimg.com/media/G_MVl3UawAA4ao9.jpg
'2014000250554372549',"RT @undefined: Newsom: ""It was remarkably boring. It was remarkably insignificant. He was never going invade Greenland. It was never real."" https://t.co/TiNcTLWbvD",en,Retweet,355,7646,949,391,306922,2026-01-21 10:40:52,"<a href=""https://snapstream.com"" rel=""nofollow"">SnapStream TV Search</a>",,,video,https://video.twimg.com/amplify_video/2014000216777646081/vid/avc1/1280x720/gTfjN6yn_ho6SIH7.mp4?tag=14
'2013980227823636667',“Americans bore 96 percent of the costs incurred by President Trump’s tariffs last year.”,en,Tweet,178,12054,2495,738,265227,2026-01-21 09:21:18,"<a href=""http://twitter.com/download/iphone"" rel=""nofollow"">Twitter for iPhone</a>",,,,
'2013974933953732687',"Trump isn’t putting the American worker first — he’s killing their jobs and loading them up with tariffs and taxes.

Costs are up — and job growth has fallen off a cliff since Trump took office.

We’re creating barely a third of the jobs we did under President Biden, and American workers are paying the price.

This isn’t revitalization — it’s deterioration.",en,Tweet,60,4693,1262,1538,143301,2026-01-21 09:00:16,"<a href=""http://twitter.com/download/iphone"" rel=""nofollow"">Twitter for iPhone</a>",,,,
'2013744283136991407',Could this smug man be more out of touch?,en,Tweet,324,24621,2942,5713,922138,2026-01-20 17:43:45,"<a href=""http://twitter.com/download/iphone"" rel=""nofollow"">Twitter for iPhone</a>",,,,
'2013700870869753990',To our allies: Stand firm. Stand tall. Stand united. https://t.co/F9TnG1S2lB,en,Tweet,247,17002,3212,3506,242659,2026-01-20 14:51:15,"<a href=""https://mobile.twitter.com"" rel=""nofollow"">Twitter Web App</a>",,,video,https://video.twimg.com/ext_tw_video/2013634864654798849/pu/vid/avc1/720x1280/amXGuSbmGR3ddiyQ.mp4?tag=12
'2013629639441424749',"America’s allies and business leaders need to understand this: 

There’s no diplomacy with Donald Trump. 

Get off your knees and grow a spine. https://t.co/epAphL4CYn",en,Tweet,1530,51221,11499,6010,1488235,2026-01-20 10:08:12,"<a href=""http://twitter.com/download/iphone"" rel=""nofollow"">Twitter for iPhone</a>",,,video,https://video.twimg.com/amplify_video/2013589431886712834/vid/avc1/1280x720/44Tpew--vbtO3Y9A.mp4?tag=21
'2013300825108427087',"MLK Jr.’s legacy reminds us that America’s promise has never been self-executing — it demands courage and moral clarity.

Honoring Dr. King today means fighting to expand opportunity, protect democracy, and ensure that freedom and fairness belong to everyone. https://t.co/PqbEtn9nzx",en,Tweet,108,5727,1225,849,440207,2026-01-19 12:21:36,"<a href=""http://twitter.com/download/iphone"" rel=""nofollow"">Twitter for iPhone</a>",,,photo,https://pbs.twimg.com/media/G_CubanXoAAOpEp.jpg
'2012333140090466648',"Donald Trump’s corrupted DOJ will stop at nothing — including ridiculous theories unsupported by facts — in pursuing his revenge agenda. 

No one is safe from his abuse of power. 

It’s sick.",en,Tweet,93,8705,1549,2221,269337,2026-01-16 20:16:22,"<a href=""http://twitter.com/download/iphone"" rel=""nofollow"">Twitter for iPhone</a>",,,,
'2012315600182300856',🤡🤡🤡 https://t.co/DpaOwoXb5A,qme,Tweet,139,7160,1193,752,187090,2026-01-16 19:06:40,"<a href=""http://twitter.com/download/iphone"" rel=""nofollow"">Twitter for iPhone</a>",,,video,https://video.twimg.com/amplify_video/2012315480388751360/vid/avc1/1080x1350/0MKZb3PM1tJXRLEp.mp4?tag=21
'2012308464102412405',"Donald Trump is trying to stoke a civil war in America. 

What he's doing in Minneapolis is a disgrace.

What @DHSgov is doing is disgusting.

Terrorizing our communities and posting white supremacy memes cannot be normalized. https://t.co/WVV54bNYhf",en,Tweet,745,46727,12251,10397,840377,2026-01-16 18:38:19,"<a href=""https://mobile.twitter.com"" rel=""nofollow"">Twitter Web App</a>",,,video,https://video.twimg.com/amplify_video/2012261321719308288/vid/avc1/960x548/LcKP4O7Afho7iE5q.mp4?tag=21
'2012287414128013389',"Trump tried to steal the 2020 election — calling around to “find votes” and now he’s attacking them again. 

We should take his threats to democracy seriously. https://t.co/a5SZFPZh7K",en,Tweet,175,5281,670,625,166506,2026-01-16 17:14:40,"<a href=""http://twitter.com/download/iphone"" rel=""nofollow"">Twitter for iPhone</a>",,,video,https://video.twimg.com/amplify_video/2012287324152020994/vid/avc1/1080x1080/ejFoiicRJTljU5xW.mp4?tag=21
'2012271034930434502',"Home to the largest startup in world history. More Fortune 500 companies than ever before. 4th largest economy in the world.

That’s California. https://t.co/I7STtITaD9",en,Tweet,75,3597,467,1336,113485,2026-01-16 16:09:35,"<a href=""http://twitter.com/download/iphone"" rel=""nofollow"">Twitter for iPhone</a>",,,video,https://video.twimg.com/amplify_video/2012270400823336960/vid/avc1/1080x1080/1evUEk5pCET6QmtC.mp4?tag=21
'2012248237416329264',Donald Trump has fostered the worst job market in 16 years. https://t.co/vx0XmWus2e,en,Tweet,215,7751,797,512,150486,2026-01-16 14:39:00,"<a href=""http://twitter.com/download/iphone"" rel=""nofollow"">Twitter for iPhone</a>",,,video,https://video.twimg.com/amplify_video/2012248165580472320/vid/avc1/1080x1080/snqQQLs-2avu2-V6.mp4?tag=21
'2012237448638529677',"BREAKING: As Donald Trump cancels free admission to National Parks on MLK Day, California will be offering FREE entry at more than 200 participating state parks.

Honor MLK. Get outdoors. And stick it to an old man with a fragile ego.",en,Tweet,2369,171900,22457,3434,2756570,2026-01-16 13:56:07,"<a href=""http://twitter.com/download/iphone"" rel=""nofollow"">Twitter for iPhone</a>",,,,
'2012236076463583492',Ben Shapiro agrees - Trump is tanking our markets. https://t.co/2JlqD6p98w,en,Tweet,116,3165,399,422,115045,2026-01-16 13:50:40,"<a href=""http://twitter.com/download/iphone"" rel=""nofollow"">Twitter for iPhone</a>",,,video,https://video.twimg.com/amplify_video/2012236000202993664/vid/avc1/1080x1080/8uPHjtTnZZK4pGfo.mp4?tag=21
'2012215232035279316',What’s Ben Shapiro hiding? https://t.co/SuaYqegqxh,en,Tweet,210,2471,293,397,173706,2026-01-16 12:27:51,"<a href=""http://twitter.com/download/iphone"" rel=""nofollow"">Twitter for iPhone</a>",,,video,https://video.twimg.com/amplify_video/2012215162833354752/vid/avc1/1080x1920/Gu4CAS1OiE9Iv-FU.mp4?tag=21
'2012205523580710916',"Donald Trump’s priorities:
1) Take away your children’s healthcare 
2) Take away your children’s access to food
3) Take away your children’s childcare 
4) Poison your children

The pro-family agenda continues! https://t.co/y6MnUZR4O5",en,Tweet,112,5589,1593,947,98958,2026-01-16 11:49:16,"<a href=""http://twitter.com/download/iphone"" rel=""nofollow"">Twitter for iPhone</a>",,,photo,https://pbs.twimg.com/media/G-zKQpPakAAFd9d.jpg
'2012002259572535651',Republicans are going to lose. https://t.co/IRIqffZIDl,en,Tweet,535,11219,949,1257,286464,2026-01-15 22:21:34,"<a href=""https://mobile.twitter.com"" rel=""nofollow"">Twitter Web App</a>",,,video,https://video.twimg.com/amplify_video/2012001750618652672/vid/avc1/1080x1080/bV6kzWZz6AJ3vPea.mp4?tag=21
'2011984055382782310',"Red states: highest murder rates in the nation, most regressive tax policies, declining in population. https://t.co/A8USVqvpLQ",en,Tweet,198,8070,1284,1396,198530,2026-01-15 21:09:14,"<a href=""https://mobile.twitter.com"" rel=""nofollow"">Twitter Web App</a>",,,video,https://video.twimg.com/amplify_video/2011982827764793346/vid/avc1/1080x1080/bJdaIYLnUUUrYaFe.mp4?tag=21
'2011967992159224091',"Fox News and the GOP don’t want you to know this:

Sanctuary policies keep our communities safer. https://t.co/vFiFc1qydw",en,Tweet,175,5297,846,4075,252121,2026-01-15 20:05:24,"<a href=""https://mobile.twitter.com"" rel=""nofollow"">Twitter Web App</a>",,,video,https://video.twimg.com/amplify_video/2011965275462406145/vid/avc1/1080x1080/Iy5VcalVdH9x9xpN.mp4?tag=21
'2011962137351242053',"16 states tax their LOW wage earners more than California taxes its HIGH wage earners. 40% of the middle class in Texas pays more in taxes than they do in California.

California’s progressive tax rates support working families. https://t.co/qHOGAyVUEa",en,Tweet,392,10109,1798,2255,548057,2026-01-15 19:42:08,"<a href=""http://twitter.com/download/iphone"" rel=""nofollow"">Twitter for iPhone</a>",,,video,https://video.twimg.com/amplify_video/2011962077909565440/vid/avc1/1080x1080/-4MqHBWMrXYEdupM.mp4?tag=21
'2011546503618445788',FAFO. https://t.co/XXyCf5UCwF,ht,Tweet,224,18886,2698,2310,363801,2026-01-14 16:10:33,"<a href=""http://twitter.com/download/iphone"" rel=""nofollow"">Twitter for iPhone</a>",,,photo,https://pbs.twimg.com/media/G-py4dWawAAihp0.jpg
'2011489740026232891',"RT @undefined: xAI’s decision to create and host a breeding ground for predators to spread nonconsensual sexually explicit AI deepfakes, including images that digitally undress children, is vile.

I am calling on the Attorney General to immediately investigate the company and hold xAI accountable.",en,Retweet,329,12586,1715,1678,979041,2026-01-14 12:25:00,"<a href=""http://twitter.com/download/iphone"" rel=""nofollow"">Twitter for iPhone</a>",,,,
'2011482281165164688',Totally normal stuff.,en,Tweet,69,7795,912,688,253517,2026-01-14 11:55:22,"<a href=""http://twitter.com/download/iphone"" rel=""nofollow"">Twitter for iPhone</a>",,,,
'2010400658222936356',"California stands in solidarity with the people of Iran, who are confronting violent repression, mass internet and power shutdowns, and economic collapse imposed by a theocratic authoritarian regime.

The scale and persistence of protests across Iran demand fundamental change after decades of state violence and denial of basic rights.

In support of California’s Iranian community and in defense of universal human rights, we urge an immediate end to violence against civilians, the restoration of internet access, and respect for the Iranian people’s right to chart their own future.",en,Tweet,444,21507,4396,5896,724154,2026-01-11 12:17:23,"<a href=""https://mobile.twitter.com"" rel=""nofollow"">Twitter Web App</a>",,,,
'2010047334860919160',"Growing up with dyslexia I struggled at school. I felt behind. Left out. Lonely.

It's a big part of what I write about in Young Man in a Hurry — out February 24.

Pre-order now: https://t.co/nmGYLEHxxr https://t.co/TO6mxG0fDm",en,Tweet,153,4377,414,2895,423706,2026-01-10 12:53:24,"<a href=""https://mobile.twitter.com"" rel=""nofollow"">Twitter Web App</a>",,http://bit.ly/4ptgWyD,photo,https://pbs.twimg.com/media/G-UfFGjasAAB_8f.jpg
'2013053660100534421',"America First Legal fights every day to preserve freedom, uphold justice, and defend the rule of law.

Every lawsuit, every complaint, and every investigation serves one mission: Fight. Defend. Save.

Fight for the American people.

Defend the Constitution.

Save our nation. https://t.co/ery7Vb60ZT",en,Tweet,294,6776,1368,185,1503855,2026-01-18 19:59:27,"<a href=""https://studio.twitter.com"" rel=""nofollow"">Twitter Media Studio</a>",,,video,https://video.twimg.com/amplify_video/2013051595911561216/vid/avc1/1920x1080/RdWro_HjOyKEhhCJ.mp4?tag=21
'2009806754234912951',What golden age? https://t.co/yt9fgYi53I,en,Tweet,161,5067,755,815,138159,2026-01-09 20:57:25,"<a href=""https://mobile.twitter.com"" rel=""nofollow"">Twitter Web App</a>",,,video,https://video.twimg.com/amplify_video/2009806251602128899/vid/avc1/1080x1350/72bmL6TI28Oi9d3L.mp4?tag=21
'2009781139716640992',"The Court saw what was obvious to us all:

The King of Fraud, Donald Trump, is desperate to distract from his own failures and tried to use our children as political pawns.

His actions were disgusting, cruel — and illegal.",en,Tweet,119,8885,2316,1159,246784,2026-01-09 19:15:38,"<a href=""http://twitter.com/download/iphone"" rel=""nofollow"">Twitter for iPhone</a>",,,,
'2009760421079626064',Oh. https://t.co/kCsxiHxEKe,und,Tweet,246,26959,1860,420,255629,2026-01-09 17:53:18,"<a href=""http://twitter.com/download/iphone"" rel=""nofollow"">Twitter for iPhone</a>",,,photo,https://pbs.twimg.com/media/G-QacwQbgAAe4hs.jpg
'2009690615337062810',"""the golden era""",en,Tweet,45,2637,568,424,162173,2026-01-09 13:15:55,"<a href=""https://mobile.twitter.com"" rel=""nofollow"">Twitter Web App</a>",,,,
'2013917282905285111',Deliveries in the snow with our friends from @JustEatTakeaway &amp; Oh My Greek! https://t.co/DGoeUUBZhp,en,Tweet,0,5,2,0,21179,2026-01-21 05:11:11,"<a href=""https://mobile.twitter.com"" rel=""nofollow"">Twitter Web App</a>",,,video,https://video.twimg.com/amplify_video/2013917165712257024/vid/avc1/1080x1920/MdKrM1uQjVRur2fD.mp4?tag=21
'2009636932364693956',"Great work, @realDonaldTrump.",en,Tweet,187,10908,2334,1314,317492,2026-01-09 09:42:36,"<a href=""http://twitter.com/download/iphone"" rel=""nofollow"">Twitter for iPhone</a>",,,,
'2009487635761500660',"Fact check: The only people receiving Trump’s “huge” tax cuts are billionaires.

Funded by cuts to Medicaid and food assistance programs.",en,Tweet,99,7721,1514,1673,224753,2026-01-08 23:49:21,"<a href=""http://twitter.com/download/iphone"" rel=""nofollow"">Twitter for iPhone</a>",,,,
'2009478435287257593',"RT @undefined: Yet another attack and shooting by President Trump’s private police force on American soil.

Disgusting. 

Remember, if you are going to protest — do so peacefully. Do not play into their games of escalation. They do not care about you, only their agenda.",en,Retweet,80,6495,822,835,228666,2026-01-08 23:12:47,"<a href=""http://twitter.com/download/iphone"" rel=""nofollow"">Twitter for iPhone</a>",,,,
'2009374433983779072',"The nation has seen an 18.1% overall increase in homelessness.

In California, homelessness just dropped 9%.

Our investments are paying off. https://t.co/4ZuSGdNIRq",en,Tweet,102,5613,768,4529,243514,2026-01-08 16:19:32,"<a href=""https://mobile.twitter.com"" rel=""nofollow"">Twitter Web App</a>",,,photo,https://pbs.twimg.com/media/G-K6whwbgAAc0DU.jpg
'2012968760131653653',Our spacious Challenger 604 cabin. Ideal for long flights. https://t.co/R4xE34OrEs,en,Tweet,12,43,4,11,198523,2026-01-18 14:22:06,"<a href=""http://twitter.com/download/iphone"" rel=""nofollow"">Twitter for iPhone</a>",,,photo,https://pbs.twimg.com/media/G--AayvXgAAMBuo.jpg
'2009355891288805417',This is the California Way. https://t.co/ciDqC7ihPs,en,Tweet,41,1711,235,548,73122,2026-01-08 15:05:51,"<a href=""https://mobile.twitter.com"" rel=""nofollow"">Twitter Web App</a>",,,video,https://video.twimg.com/amplify_video/2009355082660474880/vid/avc1/1080x1080/zZ69eo0xVg9oiEJw.mp4?tag=21
'2009354858328199393',It’s time for the President of the United States to act like a President for ALL the United States. https://t.co/DzlmdLDrkk,en,Tweet,112,6846,1010,1747,191093,2026-01-08 15:01:44,"<a href=""https://mobile.twitter.com"" rel=""nofollow"">Twitter Web App</a>",,,video,https://video.twimg.com/amplify_video/2009354459760267264/vid/avc1/1080x1080/KOQthovXXr8RH6kK.mp4?tag=21
'2009348406112866795',BREAKING: California’s homeless population just dropped 9% statewide — the largest drop in nearly two decades. https://t.co/2RY41sZWir,en,Tweet,67,4380,630,4029,189339,2026-01-08 14:36:06,"<a href=""https://mobile.twitter.com"" rel=""nofollow"">Twitter Web App</a>",,,video,https://video.twimg.com/amplify_video/2009348187601940480/vid/avc1/1080x1080/hc6fQq_RcOSbDMtb.mp4?tag=21
'2012672267742835043',"Another ""timeless"" punchline from President Reagan. https://t.co/Uo07MtKvt8",en,Tweet,124,943,148,25,150117,2026-01-17 18:43:56,"<a href=""https://mobile.twitter.com"" rel=""nofollow"">Twitter Web App</a>",,,video,https://video.twimg.com/amplify_video/2012669144731099136/vid/avc1/1080x1920/AIJW0WKlesGOUgjm.mp4?tag=21
'2009344374409449688',"What you won’t hear on Fox News today:

Texas and Florida are the REAL high-tax states.

They have some of the most regressive taxes in the nation — hammering low-income earners more than the rich. https://t.co/c7W1dPefXq",en,Tweet,195,6852,1568,2441,257762,2026-01-08 14:20:05,"<a href=""https://mobile.twitter.com"" rel=""nofollow"">Twitter Web App</a>",,,video,https://video.twimg.com/amplify_video/2009343593325215744/vid/avc1/1080x1080/DTBBzfMA--0zNuh_.mp4?tag=21
'2009343230614360193',"In California alone, Trump and @SpeakerJohnson are stripping away 1.8 million Californians’ health insurance.

All for tax breaks for the rich.

Remember that this November. https://t.co/D3Xt5iFrXi",en,Tweet,38,3014,645,701,85320,2026-01-08 14:15:32,"<a href=""https://mobile.twitter.com"" rel=""nofollow"">Twitter Web App</a>",,,video,https://video.twimg.com/amplify_video/2009342897464987659/vid/avc1/1080x1080/EyefpCtP3KTDMOOn.mp4?tag=21
'2009340007400747381',"To @realDonaldTrump: Your actions are cruel, unjust, and illegal. Consider this your warning. California will keep fighting — and winning. https://t.co/v2iMpVkOcr",en,Tweet,302,23444,3570,3138,267042,2026-01-08 14:02:44,"<a href=""https://mobile.twitter.com"" rel=""nofollow"">Twitter Web App</a>",,,video,https://video.twimg.com/amplify_video/2009339810612436992/vid/avc1/1080x1080/2MWIWbMNE1_8X7U3.mp4?tag=21
'2009337696121245852',"Crony capitalism at an unimaginable scale. Self-dealing. Profit-making, not policy-making.

Rolling back rights – attacking marginalized communities, rewriting history. Censoring historical facts. 

What is happening in Washington is not normal.",en,Tweet,61,2707,610,638,76825,2026-01-08 13:53:33,"<a href=""https://mobile.twitter.com"" rel=""nofollow"">Twitter Web App</a>",,,video,https://video.twimg.com/amplify_video/2009337435625541634/vid/avc1/1080x1080/9-Cho2CmDoCCNTi_.mp4?tag=21
'2009324432272019711',RT @undefined: LIVE NOW: Governor Gavin Newsom delivers his 2026 State of the State address before a joint session of the California Legislature. https://t.co/Z3EV8i3PQD,en,Retweet,54,1129,278,359,79463,2026-01-08 13:00:50,"<a href=""https://studio.twitter.com"" rel=""nofollow"">Twitter Media Studio</a>",,https://x.com/i/broadcasts/1lDxLByMVbkGm,,
'2009120181638058478',"Namaste, JD. https://t.co/4i4lPjudDI",in,Tweet,344,19289,1246,2286,870263,2026-01-07 23:29:13,"<a href=""http://twitter.com/download/iphone"" rel=""nofollow"">Twitter for iPhone</a>",,,photo,https://pbs.twimg.com/media/G-HUKBxa0AEZ9rL.jpg
'2009006759843938678',"When LA burned, Trump and Elon Musk spread lies.

They politicized a tragedy.

California doesn’t kneel to BS. https://t.co/MzbMCoe5XX",en,Tweet,354,26244,4073,5974,827583,2026-01-07 15:58:31,"<a href=""https://mobile.twitter.com"" rel=""nofollow"">Twitter Web App</a>",,,video,https://video.twimg.com/amplify_video/2009005316164485120/vid/avc1/1080x1080/03GGXoapbVzmaEcy.mp4?tag=21
'2008951465184780725',"One year later, Trump is still REFUSING to release $33.9 BILLION in fire disaster aid OWED to victims.

Promises made. Promises broken. https://t.co/EFgq4EMENB",en,Tweet,685,38062,7898,9054,1346074,2026-01-07 12:18:48,"<a href=""https://mobile.twitter.com"" rel=""nofollow"">Twitter Web App</a>",,,video,https://video.twimg.com/amplify_video/2008951092080726019/vid/avc1/1080x1350/vkIm0LB33g98WjHZ.mp4?tag=21
'2008729306735014080',The @GOP don’t give a shit about you — or your kids.,en,Tweet,361,29891,5307,5227,1007762,2026-01-06 21:36:01,"<a href=""http://twitter.com/download/iphone"" rel=""nofollow"">Twitter for iPhone</a>",,,,
'2008674419804434505',"Donald Trump and Speaker Johnson will not promote free and fair elections.

Proof? January 6. https://t.co/s1SakaYCnr",en,Tweet,270,19047,4109,4560,408271,2026-01-06 17:57:55,"<a href=""https://mobile.twitter.com"" rel=""nofollow"">Twitter Web App</a>",,,video,https://video.twimg.com/amplify_video/2008673900486610944/vid/avc1/1080x1080/5Tk3XfEVNw7W-Fxa.mp4?tag=21
'2012197001538978158',The forecast is just a suggestion when you have the right tires. Don't let the winter dictate your drive. Get the grip that makes you feel unstoppable at Town Fair Tire. ☃️ https://t.co/9fpCyh67bJ,en,Tweet,0,10,1,3,65915,2026-01-16 11:15:24,"<a href=""https://mobile.twitter.com"" rel=""nofollow"">Twitter Web App</a>",,,video,https://video.twimg.com/amplify_video/2012196837944705024/vid/avc1/1920x1080/f8jJKAxIfYFOHl1B.mp4?tag=21
'2008576945060278616',"RT @undefined: Congressman Doug LaMalfa was a devoted public servant who deeply loved his country, his state, and the communities he represented. While we often approached issues from different perspectives, he fought every day for the people of California with conviction and care. He will be deeply missed.

Jennifer and I are holding Doug’s family, loved ones, and colleagues in our thoughts as California mourns his passing.",en,Retweet,54,2204,247,233,143772,2026-01-06 11:30:35,"<a href=""http://twitter.com/download/iphone"" rel=""nofollow"">Twitter for iPhone</a>",,,photo,https://pbs.twimg.com/media/G9_mFj3bcAMkCHZ.jpg
'2008409343172153473',"Louisiana ranking for best states: #50.

Dead last. Not good Mike.

California’s population has grown for the last 3 consecutive years.

Fix your own damn state. https://t.co/SZcTRymqE4",en,Tweet,329,29338,3772,3662,12259938,2026-01-06 00:24:36,"<a href=""http://twitter.com/download/iphone"" rel=""nofollow"">Twitter for iPhone</a>",,,photo,https://pbs.twimg.com/media/G99Np4IbcAQFuRD.jpg
'2008275812425007380',"Tim Walz is a man of character, strength, and compassion. He has served Minnesota with heart and dignity.

Minnesota -- and America -- is better off thanks to his lifelong public service. Wishing him all the best in this next chapter. Thank you, @Tim_Walz.",en,Tweet,786,40719,3901,31404,2841689,2026-01-05 15:34:00,"<a href=""https://mobile.twitter.com"" rel=""nofollow"">Twitter Web App</a>",,,,
'2007284165721678164',"RT @undefined: California just got military troops with weapons of war off of the streets of our cities, but now Republican activists on the Ninth Circuit want to replace them with gunslingers and return to the days of the Wild West. 

California's law was carefully crafted to comply with the Second Amendment and we're confident this decision will not stand.",en,Retweet,95,3240,536,850,352613,2026-01-02 21:53:33,"<a href=""https://mobile.twitter.com"" rel=""nofollow"">Twitter Web App</a>",,,,
'2007207815325405399',Millions of Americans just saw their health care premiums rise by an average of 114%.,en,Tweet,333,28209,3618,6063,1223724,2026-01-02 16:50:09,"<a href=""https://mobile.twitter.com"" rel=""nofollow"">Twitter Web App</a>",,,,
'2012196111675457773',"We’re excited to welcome Santiago Yee to LPA as Financial Analyst in Mexico!

He’ll support our growth through financial modeling, underwriting, and reporting across our logistics platform.

Welcome aboard, Santiago! https://t.co/gpvhxgMMzc",en,Tweet,30,136,9,13,1361008,2026-01-16 11:11:52,"<a href=""https://mobile.twitter.com"" rel=""nofollow"">Twitter Web App</a>",,,photo,https://pbs.twimg.com/media/G-zBsqMWAAAZbj8.jpg
'2006762153030856757',Happy new year from Donald Trump and Mike Johnson.,en,Tweet,172,14408,3624,2549,634565,2026-01-01 11:19:15,"<a href=""http://twitter.com/download/iphone"" rel=""nofollow"">Twitter for iPhone</a>",,,,
'2006445575664009385',You don’t say.,en,Tweet,251,27162,3062,882,792458,2025-12-31 14:21:17,"<a href=""http://twitter.com/download/iphone"" rel=""nofollow"">Twitter for iPhone</a>",,,,
